{
  "schema_version": 1, "minimum_reader_version": "0.4.0", "digest": "sha256:352372889f2be025afe0dfcbb67ef3754aaa75a66fb1f283ec198c776252abca", "project_id": "project-p",
  "candidates": [{
    "candidate_id": "candidate-1", "project_id": "project-p", "question": "Where should this question be placed?",
    "source_turn_refs": [{ "provider": "opencode", "session_id": "same-native-id", "turn_unit_id": "turn-1" }],
    "recommended_relation": "keep_pending", "recommended_target_id": null, "alternate_target_ids": [], "related_node_ids": [],
    "grounds": [{ "rule_id": "explicit-reference", "rule_version": "v1", "matched_fact_refs": ["fact-1"], "explanation": "No authenticated parent signal was present." }],
    "confidence": "low", "status": "pending",
    "dependency_digests": ["sha256:1111111111111111111111111111111111111111111111111111111111111111"],
    "analysis_mode": "deterministic", "agent_run_id": null, "revision": 1,
    "created_at": "2026-09-04T00:00:00Z", "updated_at": "2026-09-04T00:00:00Z"
  }]
}
